{
  "benchmark_id": "bench.examples.suite.registry.four_modes.v1",
  "created_at": "1970-01-01T00:00:00Z",
  "entries": [
    {
      "col_label": "v-cli",
      "mean_abs_score_delta": 0.0,
      "prompt_ids": [
        "p-repo",
        "p-md",
        "p-matrix",
        "p-browser"
      ],
      "row_label": "v-cli",
      "variant_i": "v-cli",
      "variant_j": "v-cli"
    }
  ],
  "matrix_id": "examples-registry-four-modes-pairwise",
  "metric": "mean_abs_total_score_delta",
  "run_id": "examples-registry-four-modes",
  "schema_version": 1
}
