{
  "benchmark_id": "bench.fixtures.campaign.micro.v1",
  "created_at": "1970-01-01T00:00:00Z",
  "entries": [
    {
      "col_label": "v-cli",
      "mean_abs_score_delta": 0.0,
      "prompt_ids": [
        "p1"
      ],
      "row_label": "v-cli",
      "variant_i": "v-cli",
      "variant_j": "v-cli"
    }
  ],
  "matrix_id": "campaign.examples.multi_suite.v1__0000-pairwise",
  "metric": "mean_abs_total_score_delta",
  "run_id": "campaign.examples.multi_suite.v1__0000",
  "schema_version": 1
}
