{
  "benchmark_id": "bench.examples.campaign.neutral.v1",
  "created_at": "1970-01-01T00:00:00Z",
  "entries": [
    {
      "col_label": "v-cli",
      "mean_abs_score_delta": 0.0,
      "prompt_ids": [
        "q01",
        "q02",
        "q03",
        "q04",
        "q05"
      ],
      "row_label": "v-cli",
      "variant_i": "v-cli",
      "variant_j": "v-cli"
    },
    {
      "col_label": "v-browser",
      "mean_abs_score_delta": 0.22581160000000003,
      "prompt_ids": [
        "q01",
        "q02",
        "q03",
        "q04",
        "q05"
      ],
      "row_label": "v-cli",
      "variant_i": "v-cli",
      "variant_j": "v-browser"
    },
    {
      "col_label": "v-repo",
      "mean_abs_score_delta": 0.1796228,
      "prompt_ids": [
        "q01",
        "q02",
        "q03",
        "q04",
        "q05"
      ],
      "row_label": "v-cli",
      "variant_i": "v-cli",
      "variant_j": "v-repo"
    },
    {
      "col_label": "v-cli",
      "mean_abs_score_delta": 0.22581160000000003,
      "prompt_ids": [
        "q01",
        "q02",
        "q03",
        "q04",
        "q05"
      ],
      "row_label": "v-browser",
      "variant_i": "v-browser",
      "variant_j": "v-cli"
    },
    {
      "col_label": "v-browser",
      "mean_abs_score_delta": 0.0,
      "prompt_ids": [
        "q01",
        "q02",
        "q03",
        "q04",
        "q05"
      ],
      "row_label": "v-browser",
      "variant_i": "v-browser",
      "variant_j": "v-browser"
    },
    {
      "col_label": "v-repo",
      "mean_abs_score_delta": 0.1792992,
      "prompt_ids": [
        "q01",
        "q02",
        "q03",
        "q04",
        "q05"
      ],
      "row_label": "v-browser",
      "variant_i": "v-browser",
      "variant_j": "v-repo"
    },
    {
      "col_label": "v-cli",
      "mean_abs_score_delta": 0.1796228,
      "prompt_ids": [
        "q01",
        "q02",
        "q03",
        "q04",
        "q05"
      ],
      "row_label": "v-repo",
      "variant_i": "v-repo",
      "variant_j": "v-cli"
    },
    {
      "col_label": "v-browser",
      "mean_abs_score_delta": 0.1792992,
      "prompt_ids": [
        "q01",
        "q02",
        "q03",
        "q04",
        "q05"
      ],
      "row_label": "v-repo",
      "variant_i": "v-repo",
      "variant_j": "v-browser"
    },
    {
      "col_label": "v-repo",
      "mean_abs_score_delta": 0.0,
      "prompt_ids": [
        "q01",
        "q02",
        "q03",
        "q04",
        "q05"
      ],
      "row_label": "v-repo",
      "variant_i": "v-repo",
      "variant_j": "v-repo"
    }
  ],
  "matrix_id": "examples-campaign-neutral-pairwise",
  "metric": "mean_abs_total_score_delta",
  "run_id": "examples-campaign-neutral",
  "schema_version": 1
}
