{
  "benchmark_id": "bench.agentic.pack.multi_agent_coordination.v1",
  "created_at": "1970-01-01T00:00:00Z",
  "entries": [
    {
      "col_label": "v-cli",
      "mean_abs_score_delta": 0.0,
      "prompt_ids": [
        "p-coord"
      ],
      "row_label": "v-cli",
      "variant_i": "v-cli",
      "variant_j": "v-cli"
    },
    {
      "col_label": "v-repo",
      "mean_abs_score_delta": 0.3974980000000001,
      "prompt_ids": [
        "p-coord"
      ],
      "row_label": "v-cli",
      "variant_i": "v-cli",
      "variant_j": "v-repo"
    },
    {
      "col_label": "v-cli",
      "mean_abs_score_delta": 0.3974980000000001,
      "prompt_ids": [
        "p-coord"
      ],
      "row_label": "v-repo",
      "variant_i": "v-repo",
      "variant_j": "v-cli"
    },
    {
      "col_label": "v-repo",
      "mean_abs_score_delta": 0.0,
      "prompt_ids": [
        "p-coord"
      ],
      "row_label": "v-repo",
      "variant_i": "v-repo",
      "variant_j": "v-repo"
    }
  ],
  "matrix_id": "agentic-pack-multi-agent-coordination-example-pairwise",
  "metric": "mean_abs_total_score_delta",
  "run_id": "agentic-pack-multi-agent-coordination-example",
  "schema_version": 1
}
