{
  "benchmark_id": "bench.fixtures.browser.checkout.v1",
  "created_at": "1970-01-01T00:00:00Z",
  "entries": [
    {
      "col_label": "v-checkout",
      "mean_abs_score_delta": 0.0,
      "prompt_ids": [
        "p-one"
      ],
      "row_label": "v-checkout",
      "variant_i": "v-checkout",
      "variant_j": "v-checkout"
    }
  ],
  "matrix_id": "campaign.examples.browser_evidence_compare.v1__0000-pairwise",
  "metric": "mean_abs_total_score_delta",
  "run_id": "campaign.examples.browser_evidence_compare.v1__0000",
  "schema_version": 1
}
