{
  "benchmark_id": "bench.examples.taxonomy.repo_governance.v1",
  "created_at": "1970-01-01T00:00:00Z",
  "entries": [
    {
      "col_label": "v-cli",
      "mean_abs_score_delta": 0.0,
      "prompt_ids": [
        "p-repo"
      ],
      "row_label": "v-cli",
      "variant_i": "v-cli",
      "variant_j": "v-cli"
    }
  ],
  "matrix_id": "taxonomy-repo-gov-example-pairwise",
  "metric": "mean_abs_total_score_delta",
  "run_id": "taxonomy-repo-gov-example",
  "schema_version": 1
}
