{
  "benchmark_id": "bench.examples.registry.mixed.v1",
  "created_at": "1970-01-01T00:00:00Z",
  "entries": [
    {
      "col_label": "v-cli",
      "mean_abs_score_delta": 0.0,
      "prompt_ids": [
        "p-inline",
        "p-reg"
      ],
      "row_label": "v-cli",
      "variant_i": "v-cli",
      "variant_j": "v-cli"
    }
  ],
  "matrix_id": "examples-registry-mixed-pairwise",
  "metric": "mean_abs_total_score_delta",
  "run_id": "examples-registry-mixed",
  "schema_version": 1
}
